{
  "formatVersion": 1,
  "id": "react19",
  "name": { "en": "React 19 + Vite", "zh-CN": "React 19 + Vite" },
  "description": {
    "en": "A React 19 and TypeScript front end built with Vite 8. Vite's error overlay keeps its colors and cannot be changed; Vite does not support --no-color.",
    "zh-CN": "用 Vite 8 构建的 React 19 加 TypeScript 前端。 Vite 的报错框颜色去不掉，Vite 也不支持 --no-color。"
  },
  "category": "frontend",
  "runner": "vite",
  "requires": {
    "node": { "version": ">=22.12 <27" },
    "pnpm": { "version": ">=10.34.6 <12", "fallback": "npm" }
  },
  "entry": "src/App.tsx",
  "substitute": ["index.html"],
  "maintainer": "Runyard"
}
