{
  "formatVersion": 1,
  "id": "python",
  "name": { "en": "Python script", "zh-CN": "Python 脚本" },
  "description": {
    "en": "Single file · standard library only · runs on save",
    "zh-CN": "单个文件 · 只用标准库 · 保存后自动运行"
  },
  "category": "script",
  "runner": "python-file",
  "requires": { "python": { "version": ">=3.12 <4" } },
  "entry": "main.py",
  "maintainer": "Runyard"
}
