{
  "formatVersion": 1,
  "id": "html",
  "name": { "en": "HTML page", "zh-CN": "HTML 页面" },
  "description": {
    "en": "HTML, CSS and JavaScript · nothing to install · reloads on save",
    "zh-CN": "HTML、CSS、JavaScript · 不用安装工具 · 保存即刷新"
  },
  "category": "page",
  "runner": "static",
  "requires": {},
  "entry": "index.html",
  "substitute": ["index.html"],
  "maintainer": "Runyard"
}
