{
  "formatVersion": 1,
  "id": "hono",
  "name": { "en": "Hono", "zh-CN": "Hono" },
  "description": {
    "en": "TypeScript HTTP service · built-in request panel · restarts on save",
    "zh-CN": "TypeScript HTTP 服务 · 自带请求面板 · 保存后自动重启"
  },
  "category": "service",
  "runner": "hono",
  "requires": {
    "node": { "version": ">=22.18 <27" },
    "pnpm": { "version": ">=10.34.6 <12", "fallback": "npm" }
  },
  "entry": "src/index.ts",
  "substitute": ["src/index.ts"],
  "maintainer": "Runyard"
}
