{
  "formatVersion": 1,
  "id": "go",
  "name": { "en": "Go program", "zh-CN": "Go 程序" },
  "description": {
    "en": "Single file · standard library only · runs on save",
    "zh-CN": "单个文件 · 只用标准库 · 保存后自动运行"
  },
  "category": "script",
  "runner": "go",
  "requires": { "go": { "version": ">=1.26 <2" } },
  "entry": "main.go",
  "maintainer": "Runyard"
}
