{
  "formatVersion": 1,
  "id": "react18",
  "name": { "en": "React 18 + Vite", "zh-CN": "React 18 + Vite" },
  "description": {
    "en": "React 18 · TypeScript · Vite 8 · no longer updated",
    "zh-CN": "React 18 · TypeScript · Vite 8 · React 18 已不再更新"
  },
  "category": "frontend",
  "runner": "vite",
  "requires": {
    "node": { "version": ">=22.13 <27" },
    "pnpm": { "version": ">=10.34.6 <12", "fallback": "npm" }
  },
  "entry": "src/App.tsx",
  "substitute": ["index.html"],
  "maintainer": "Runyard"
}
